# manual ndb_import tests
# database argument is required
# no args is ok
# table does not exist
create table t1 (
a int primary key,
b int not null
) engine=ndb;
# csv file does not exist
# bad state dir
# normal import
select count(*) from t1;
count(*)
1000
# invalid --input-type
# invalid --output-type
# test --connections and --ndb-nodeid
# needs consecutive api nodes 230,231,232
delete from t1;
create table t1ver like t1;
select count(*) from t1 x, t1ver y
where x.a = y.a and x.b = y.b;
count(*)
1000
# simple utf8 test
create table t2 (
a int primary key,
b char(3)
) charset utf8mb4
engine=ndb;
create table t2ver (
a int primary key,
b char(3)
) charset utf8mb4
engine=ndb;
select count(*) from t2 x, t2ver y
where x.a = y.a
and (x.b = y.b or (x.b is null and y.b is null));
count(*)
4
# simple hidden-pk test
create table t3 (
b int not null,
# unique key would turn into pk
key bx (b)
) engine=ndb;
create table t3ver like t3;
select count(*) from t3;
count(*)
1000
select count(*) from t3ver;
count(*)
1000
select count(*) from t3 x, t3ver y
where x.b = y.b;
count(*)
1000
# test with rejects and no --keep-state
create table t4 (
a int primary key,
b int not null
) engine=ndb;
select count(*) from t4;
count(*)
998
# test with rejects and --stats
delete from t4;
select count(*) from t4;
count(*)
998
# test quoting and escapes
create table t6 (
a int primary key,
b char(5) not null
) engine=ndb;
create table t6ver like t6;
select count(*) from t6 x, t6ver y
where x.a = y.a and x.b = y.b;
count(*)
7
select a from t6
where b like '%"%'
order by a;
a
3
4
5
# test CR-LF line terminator
create table t7 (
a int primary key,
b varbinary(20)
) engine=ndb;
create table t7ver like t7;
select count(*) from t7 x, t7ver y
where x.a = y.a
and (x.b = y.b or (x.b is null and y.b is null));
count(*)
1000
# test windows directory separator
delete from t7;
select count(*) from t7;
count(*)
1000
t7.csv
t7.map
t7.rej
t7.res
# test NUL byte
create table t8 (
a int primary key,
b varbinary(20)
) engine=ndb;
create table t8ver like t8;
select count(*) from t8 x, t8ver y
where x.a = y.a
and (x.b = y.b or (x.b is null and y.b is null));
count(*)
1000
# test long field and line terminators
create table t9 (
a int primary key,
b char(10),
c char(10)
) engine=ndb;
create table t9ver like t9;
select * from t9ver order by a;
a	b	c
0	123	abc
1	:456=	:foo=
2	789===	bar===
3	123	abc
4	:456=	:foo=
5	789===	bar===
select count(*) from t9 x, t9ver y
where x.a = y.a
and (x.b = y.b or (x.b is null and y.b is null))
and (x.c = y.c or (x.c is null and y.c is null));
count(*)
6
# run backup
SELECT * FROM t6 WHERE a > 30 order by a;
a	b
31	xyz
32	Rfc
33	
34	
CREATE TABLE tpersons (
id INT NOT NULL PRIMARY KEY,
date_born DATE NOT NULL,
first_name VARCHAR(14) NOT NULL COLUMN_FORMAT FIXED,
last_name VARCHAR(16) NOT NULL COLUMN_FORMAT FIXED,
gender CHAR(1) NOT NULL,
date_died DATE NOT NULL
) engine=ndb CHARACTER SET latin1;
CREATE TABLE tauto_inc1 (
id INT NOT NULL AUTO_INCREMENT PRIMARY KEY,
val INT NOT NULL
) engine=NDB;
CREATE TABLE tauto_inc2 (
id INT NOT NULL AUTO_INCREMENT PRIMARY KEY,
val INT NOT NULL
) engine=NDB;
CREATE TABLE tauto_inc3 (
id BIGINT NOT NULL AUTO_INCREMENT PRIMARY KEY,
val INT NOT NULL
) engine=NDB;
select id from tauto_inc1 order by id;
id
1
2
3
4
5
select id from tauto_inc2 order by id;
id
1
2
3
4
5
select id from tauto_inc3 order by id;
id
1
2
3
4
5
include/assert_grep.inc [Require CSV parser to fail with syntax error]
create table t10 (
a int primary key,
b int not null,
c varchar(16) not null
) engine=ndb CHARACTER SET latin1;
include/assert_grep.inc [No --table argument and csv filename does not match any table name]
delete from t10;
create table t10ver like t10;
select count(*) from t10 x, t10ver y
where x.a = y.a and x.b = y.b and x.c = y.c;
count(*)
5
delete from t10;
# check .rej file exists and match the input csv filename
# check .rej file matching the table name does not exists
delete from t10;
# check order matters when using --csvopt and --fields-terminated-by
drop table tauto_inc1;
drop table tauto_inc2;
drop table tauto_inc3;
drop table tpersons;
drop table t1, t1ver, t2, t2ver, t3, t3ver, t4,
t6, t6ver, t7, t7ver, t8, t8ver, t9, t9ver, t10, t10ver;
