#
# Test: test_read_expired_rows
# Insert already-expired rows, SELECT should return 0
#
CREATE DATABASE IF NOT EXISTS ttl_concurrent;
DROP TABLE IF EXISTS ttl_concurrent.read_expired;
CREATE TABLE ttl_concurrent.read_expired (id INT PRIMARY KEY, ttl_col DATETIME, data VARCHAR(100)) ENGINE=NDB COMMENT="NDB_TABLE=TTL=3600@ttl_col";
CREATE INDEX ttl_index ON ttl_concurrent.read_expired(ttl_col);
ALTER TABLE ttl_concurrent.read_expired COMMENT="NDB_TABLE=TTL=5@ttl_col";
INSERT INTO ttl_concurrent.read_expired (id, ttl_col, data) VALUES (1, DATE_SUB(NOW(), INTERVAL 5 MINUTE), 'expired_row_1');
INSERT INTO ttl_concurrent.read_expired (id, ttl_col, data) VALUES (2, DATE_SUB(NOW(), INTERVAL 5 MINUTE), 'expired_row_2');
INSERT INTO ttl_concurrent.read_expired (id, ttl_col, data) VALUES (3, DATE_SUB(NOW(), INTERVAL 5 MINUTE), 'expired_row_3');
INSERT INTO ttl_concurrent.read_expired (id, ttl_col, data) VALUES (4, DATE_SUB(NOW(), INTERVAL 5 MINUTE), 'expired_row_4');
INSERT INTO ttl_concurrent.read_expired (id, ttl_col, data) VALUES (5, DATE_SUB(NOW(), INTERVAL 5 MINUTE), 'expired_row_5');
INSERT INTO ttl_concurrent.read_expired (id, ttl_col, data) VALUES (6, DATE_SUB(NOW(), INTERVAL 5 MINUTE), 'expired_row_6');
INSERT INTO ttl_concurrent.read_expired (id, ttl_col, data) VALUES (7, DATE_SUB(NOW(), INTERVAL 5 MINUTE), 'expired_row_7');
INSERT INTO ttl_concurrent.read_expired (id, ttl_col, data) VALUES (8, DATE_SUB(NOW(), INTERVAL 5 MINUTE), 'expired_row_8');
INSERT INTO ttl_concurrent.read_expired (id, ttl_col, data) VALUES (9, DATE_SUB(NOW(), INTERVAL 5 MINUTE), 'expired_row_9');
INSERT INTO ttl_concurrent.read_expired (id, ttl_col, data) VALUES (10, DATE_SUB(NOW(), INTERVAL 5 MINUTE), 'expired_row_10');
include/assert.inc [Expired rows should not be visible via SELECT]
DROP DATABASE ttl_concurrent;
#
# Test: test_insert_while_purging
# Insert expired rows, then insert valid rows; valid rows survive
#
CREATE DATABASE IF NOT EXISTS ttl_concurrent;
DROP TABLE IF EXISTS ttl_concurrent.insert_while;
CREATE TABLE ttl_concurrent.insert_while (id INT PRIMARY KEY, ttl_col DATETIME, data VARCHAR(100)) ENGINE=NDB COMMENT="NDB_TABLE=TTL=3600@ttl_col";
CREATE INDEX ttl_index ON ttl_concurrent.insert_while(ttl_col);
ALTER TABLE ttl_concurrent.insert_while COMMENT="NDB_TABLE=TTL=5@ttl_col";
INSERT INTO ttl_concurrent.insert_while (id, ttl_col, data) VALUES (1, DATE_SUB(NOW(), INTERVAL 5 MINUTE), 'expired_row_1');
INSERT INTO ttl_concurrent.insert_while (id, ttl_col, data) VALUES (2, DATE_SUB(NOW(), INTERVAL 5 MINUTE), 'expired_row_2');
INSERT INTO ttl_concurrent.insert_while (id, ttl_col, data) VALUES (3, DATE_SUB(NOW(), INTERVAL 5 MINUTE), 'expired_row_3');
INSERT INTO ttl_concurrent.insert_while (id, ttl_col, data) VALUES (4, DATE_SUB(NOW(), INTERVAL 5 MINUTE), 'expired_row_4');
INSERT INTO ttl_concurrent.insert_while (id, ttl_col, data) VALUES (5, DATE_SUB(NOW(), INTERVAL 5 MINUTE), 'expired_row_5');
INSERT INTO ttl_concurrent.insert_while (id, ttl_col, data) VALUES (6, DATE_SUB(NOW(), INTERVAL 5 MINUTE), 'expired_row_6');
INSERT INTO ttl_concurrent.insert_while (id, ttl_col, data) VALUES (7, DATE_SUB(NOW(), INTERVAL 5 MINUTE), 'expired_row_7');
INSERT INTO ttl_concurrent.insert_while (id, ttl_col, data) VALUES (8, DATE_SUB(NOW(), INTERVAL 5 MINUTE), 'expired_row_8');
INSERT INTO ttl_concurrent.insert_while (id, ttl_col, data) VALUES (9, DATE_SUB(NOW(), INTERVAL 5 MINUTE), 'expired_row_9');
INSERT INTO ttl_concurrent.insert_while (id, ttl_col, data) VALUES (10, DATE_SUB(NOW(), INTERVAL 5 MINUTE), 'expired_row_10');
INSERT INTO ttl_concurrent.insert_while (id, ttl_col, data) VALUES (11, DATE_SUB(NOW(), INTERVAL 5 MINUTE), 'expired_row_11');
INSERT INTO ttl_concurrent.insert_while (id, ttl_col, data) VALUES (12, DATE_SUB(NOW(), INTERVAL 5 MINUTE), 'expired_row_12');
INSERT INTO ttl_concurrent.insert_while (id, ttl_col, data) VALUES (13, DATE_SUB(NOW(), INTERVAL 5 MINUTE), 'expired_row_13');
INSERT INTO ttl_concurrent.insert_while (id, ttl_col, data) VALUES (14, DATE_SUB(NOW(), INTERVAL 5 MINUTE), 'expired_row_14');
INSERT INTO ttl_concurrent.insert_while (id, ttl_col, data) VALUES (15, DATE_SUB(NOW(), INTERVAL 5 MINUTE), 'expired_row_15');
INSERT INTO ttl_concurrent.insert_while (id, ttl_col, data) VALUES (16, DATE_SUB(NOW(), INTERVAL 5 MINUTE), 'expired_row_16');
INSERT INTO ttl_concurrent.insert_while (id, ttl_col, data) VALUES (17, DATE_SUB(NOW(), INTERVAL 5 MINUTE), 'expired_row_17');
INSERT INTO ttl_concurrent.insert_while (id, ttl_col, data) VALUES (18, DATE_SUB(NOW(), INTERVAL 5 MINUTE), 'expired_row_18');
INSERT INTO ttl_concurrent.insert_while (id, ttl_col, data) VALUES (19, DATE_SUB(NOW(), INTERVAL 5 MINUTE), 'expired_row_19');
INSERT INTO ttl_concurrent.insert_while (id, ttl_col, data) VALUES (20, DATE_SUB(NOW(), INTERVAL 5 MINUTE), 'expired_row_20');
INSERT INTO ttl_concurrent.insert_while (id, ttl_col, data) VALUES (21, DATE_SUB(NOW(), INTERVAL 5 MINUTE), 'expired_row_21');
INSERT INTO ttl_concurrent.insert_while (id, ttl_col, data) VALUES (22, DATE_SUB(NOW(), INTERVAL 5 MINUTE), 'expired_row_22');
INSERT INTO ttl_concurrent.insert_while (id, ttl_col, data) VALUES (23, DATE_SUB(NOW(), INTERVAL 5 MINUTE), 'expired_row_23');
INSERT INTO ttl_concurrent.insert_while (id, ttl_col, data) VALUES (24, DATE_SUB(NOW(), INTERVAL 5 MINUTE), 'expired_row_24');
INSERT INTO ttl_concurrent.insert_while (id, ttl_col, data) VALUES (25, DATE_SUB(NOW(), INTERVAL 5 MINUTE), 'expired_row_25');
INSERT INTO ttl_concurrent.insert_while (id, ttl_col, data) VALUES (26, DATE_SUB(NOW(), INTERVAL 5 MINUTE), 'expired_row_26');
INSERT INTO ttl_concurrent.insert_while (id, ttl_col, data) VALUES (27, DATE_SUB(NOW(), INTERVAL 5 MINUTE), 'expired_row_27');
INSERT INTO ttl_concurrent.insert_while (id, ttl_col, data) VALUES (28, DATE_SUB(NOW(), INTERVAL 5 MINUTE), 'expired_row_28');
INSERT INTO ttl_concurrent.insert_while (id, ttl_col, data) VALUES (29, DATE_SUB(NOW(), INTERVAL 5 MINUTE), 'expired_row_29');
INSERT INTO ttl_concurrent.insert_while (id, ttl_col, data) VALUES (30, DATE_SUB(NOW(), INTERVAL 5 MINUTE), 'expired_row_30');
INSERT INTO ttl_concurrent.insert_while (id, ttl_col, data) VALUES (31, DATE_SUB(NOW(), INTERVAL 5 MINUTE), 'expired_row_31');
INSERT INTO ttl_concurrent.insert_while (id, ttl_col, data) VALUES (32, DATE_SUB(NOW(), INTERVAL 5 MINUTE), 'expired_row_32');
INSERT INTO ttl_concurrent.insert_while (id, ttl_col, data) VALUES (33, DATE_SUB(NOW(), INTERVAL 5 MINUTE), 'expired_row_33');
INSERT INTO ttl_concurrent.insert_while (id, ttl_col, data) VALUES (34, DATE_SUB(NOW(), INTERVAL 5 MINUTE), 'expired_row_34');
INSERT INTO ttl_concurrent.insert_while (id, ttl_col, data) VALUES (35, DATE_SUB(NOW(), INTERVAL 5 MINUTE), 'expired_row_35');
INSERT INTO ttl_concurrent.insert_while (id, ttl_col, data) VALUES (36, DATE_SUB(NOW(), INTERVAL 5 MINUTE), 'expired_row_36');
INSERT INTO ttl_concurrent.insert_while (id, ttl_col, data) VALUES (37, DATE_SUB(NOW(), INTERVAL 5 MINUTE), 'expired_row_37');
INSERT INTO ttl_concurrent.insert_while (id, ttl_col, data) VALUES (38, DATE_SUB(NOW(), INTERVAL 5 MINUTE), 'expired_row_38');
INSERT INTO ttl_concurrent.insert_while (id, ttl_col, data) VALUES (39, DATE_SUB(NOW(), INTERVAL 5 MINUTE), 'expired_row_39');
INSERT INTO ttl_concurrent.insert_while (id, ttl_col, data) VALUES (40, DATE_SUB(NOW(), INTERVAL 5 MINUTE), 'expired_row_40');
INSERT INTO ttl_concurrent.insert_while (id, ttl_col, data) VALUES (41, DATE_SUB(NOW(), INTERVAL 5 MINUTE), 'expired_row_41');
INSERT INTO ttl_concurrent.insert_while (id, ttl_col, data) VALUES (42, DATE_SUB(NOW(), INTERVAL 5 MINUTE), 'expired_row_42');
INSERT INTO ttl_concurrent.insert_while (id, ttl_col, data) VALUES (43, DATE_SUB(NOW(), INTERVAL 5 MINUTE), 'expired_row_43');
INSERT INTO ttl_concurrent.insert_while (id, ttl_col, data) VALUES (44, DATE_SUB(NOW(), INTERVAL 5 MINUTE), 'expired_row_44');
INSERT INTO ttl_concurrent.insert_while (id, ttl_col, data) VALUES (45, DATE_SUB(NOW(), INTERVAL 5 MINUTE), 'expired_row_45');
INSERT INTO ttl_concurrent.insert_while (id, ttl_col, data) VALUES (46, DATE_SUB(NOW(), INTERVAL 5 MINUTE), 'expired_row_46');
INSERT INTO ttl_concurrent.insert_while (id, ttl_col, data) VALUES (47, DATE_SUB(NOW(), INTERVAL 5 MINUTE), 'expired_row_47');
INSERT INTO ttl_concurrent.insert_while (id, ttl_col, data) VALUES (48, DATE_SUB(NOW(), INTERVAL 5 MINUTE), 'expired_row_48');
INSERT INTO ttl_concurrent.insert_while (id, ttl_col, data) VALUES (49, DATE_SUB(NOW(), INTERVAL 5 MINUTE), 'expired_row_49');
INSERT INTO ttl_concurrent.insert_while (id, ttl_col, data) VALUES (50, DATE_SUB(NOW(), INTERVAL 5 MINUTE), 'expired_row_50');
INSERT INTO ttl_concurrent.insert_while (id, ttl_col, data) VALUES (1000, DATE_ADD(NOW(), INTERVAL 1 HOUR), 'valid_row_1000');
INSERT INTO ttl_concurrent.insert_while (id, ttl_col, data) VALUES (1001, DATE_ADD(NOW(), INTERVAL 1 HOUR), 'valid_row_1001');
INSERT INTO ttl_concurrent.insert_while (id, ttl_col, data) VALUES (1002, DATE_ADD(NOW(), INTERVAL 1 HOUR), 'valid_row_1002');
INSERT INTO ttl_concurrent.insert_while (id, ttl_col, data) VALUES (1003, DATE_ADD(NOW(), INTERVAL 1 HOUR), 'valid_row_1003');
INSERT INTO ttl_concurrent.insert_while (id, ttl_col, data) VALUES (1004, DATE_ADD(NOW(), INTERVAL 1 HOUR), 'valid_row_1004');
INSERT INTO ttl_concurrent.insert_while (id, ttl_col, data) VALUES (1005, DATE_ADD(NOW(), INTERVAL 1 HOUR), 'valid_row_1005');
INSERT INTO ttl_concurrent.insert_while (id, ttl_col, data) VALUES (1006, DATE_ADD(NOW(), INTERVAL 1 HOUR), 'valid_row_1006');
INSERT INTO ttl_concurrent.insert_while (id, ttl_col, data) VALUES (1007, DATE_ADD(NOW(), INTERVAL 1 HOUR), 'valid_row_1007');
INSERT INTO ttl_concurrent.insert_while (id, ttl_col, data) VALUES (1008, DATE_ADD(NOW(), INTERVAL 1 HOUR), 'valid_row_1008');
INSERT INTO ttl_concurrent.insert_while (id, ttl_col, data) VALUES (1009, DATE_ADD(NOW(), INTERVAL 1 HOUR), 'valid_row_1009');
INSERT INTO ttl_concurrent.insert_while (id, ttl_col, data) VALUES (1010, DATE_ADD(NOW(), INTERVAL 1 HOUR), 'valid_row_1010');
INSERT INTO ttl_concurrent.insert_while (id, ttl_col, data) VALUES (1011, DATE_ADD(NOW(), INTERVAL 1 HOUR), 'valid_row_1011');
INSERT INTO ttl_concurrent.insert_while (id, ttl_col, data) VALUES (1012, DATE_ADD(NOW(), INTERVAL 1 HOUR), 'valid_row_1012');
INSERT INTO ttl_concurrent.insert_while (id, ttl_col, data) VALUES (1013, DATE_ADD(NOW(), INTERVAL 1 HOUR), 'valid_row_1013');
INSERT INTO ttl_concurrent.insert_while (id, ttl_col, data) VALUES (1014, DATE_ADD(NOW(), INTERVAL 1 HOUR), 'valid_row_1014');
INSERT INTO ttl_concurrent.insert_while (id, ttl_col, data) VALUES (1015, DATE_ADD(NOW(), INTERVAL 1 HOUR), 'valid_row_1015');
INSERT INTO ttl_concurrent.insert_while (id, ttl_col, data) VALUES (1016, DATE_ADD(NOW(), INTERVAL 1 HOUR), 'valid_row_1016');
INSERT INTO ttl_concurrent.insert_while (id, ttl_col, data) VALUES (1017, DATE_ADD(NOW(), INTERVAL 1 HOUR), 'valid_row_1017');
INSERT INTO ttl_concurrent.insert_while (id, ttl_col, data) VALUES (1018, DATE_ADD(NOW(), INTERVAL 1 HOUR), 'valid_row_1018');
INSERT INTO ttl_concurrent.insert_while (id, ttl_col, data) VALUES (1019, DATE_ADD(NOW(), INTERVAL 1 HOUR), 'valid_row_1019');
include/assert.inc [Valid rows should survive purge]
DROP DATABASE ttl_concurrent;
#
# Test: test_update_expired_row
# UPDATE an expired row should affect 0 rows
#
CREATE DATABASE IF NOT EXISTS ttl_concurrent;
DROP TABLE IF EXISTS ttl_concurrent.update_test;
CREATE TABLE ttl_concurrent.update_test (id INT PRIMARY KEY, ttl_col DATETIME, data VARCHAR(100)) ENGINE=NDB COMMENT="NDB_TABLE=TTL=3600@ttl_col";
CREATE INDEX ttl_index ON ttl_concurrent.update_test(ttl_col);
ALTER TABLE ttl_concurrent.update_test COMMENT="NDB_TABLE=TTL=5@ttl_col";
INSERT INTO ttl_concurrent.update_test (id, ttl_col, data)
VALUES (1, DATE_SUB(NOW(), INTERVAL 5 MINUTE), 'expired');
UPDATE ttl_concurrent.update_test SET data = 'updated' WHERE id = 1;
SELECT ROW_COUNT() INTO @update_rc;
include/assert.inc [UPDATE on expired row should affect 0 rows]
include/assert.inc [Table should appear empty after expired insert]
DROP DATABASE ttl_concurrent;
#
# Test: test_delete_expired_row
# DELETE an expired row should affect 0 rows
#
CREATE DATABASE IF NOT EXISTS ttl_concurrent;
DROP TABLE IF EXISTS ttl_concurrent.delete_test;
CREATE TABLE ttl_concurrent.delete_test (id INT PRIMARY KEY, ttl_col DATETIME, data VARCHAR(100)) ENGINE=NDB COMMENT="NDB_TABLE=TTL=3600@ttl_col";
CREATE INDEX ttl_index ON ttl_concurrent.delete_test(ttl_col);
ALTER TABLE ttl_concurrent.delete_test COMMENT="NDB_TABLE=TTL=5@ttl_col";
INSERT INTO ttl_concurrent.delete_test (id, ttl_col, data)
VALUES (1, DATE_SUB(NOW(), INTERVAL 5 MINUTE), 'expired');
DELETE FROM ttl_concurrent.delete_test WHERE id = 1;
SELECT ROW_COUNT() INTO @delete_rc;
include/assert.inc [DELETE on expired row should affect 0 rows]
include/assert.inc [Table should appear empty]
DROP DATABASE ttl_concurrent;
#
# Test: test_concurrent_api_calls (simplified)
# Sequential GET calls to each endpoint, all should succeed
#
Config endpoint returned OK
Status endpoint returned OK
Metrics endpoint returned OK
Tables endpoint returned OK
Combined endpoint returned OK
# All concurrent operation tests passed
