include/rpl/init_source_replica.inc
Warnings:
Note	####	Sending passwords in plain text without SSL/TLS is extremely insecure.
Note	####	Storing MySQL user name or password information in the connection metadata repository is not secure and is therefore not recommended. Please consider using the USER and PASSWORD connection options for START REPLICA; see the 'START REPLICA Syntax' in the MySQL Manual for more information.
[connection master]
#
# Case 1: CREATE TABLE DDL replicates with MAX_ROWS_PER_PK comment
#
CREATE TABLE test.rb (
client_id INT NOT NULL,
ring_idx INT NOT NULL DEFAULT 0,
ring_meta VARBINARY(64),
event_data VARCHAR(100),
PRIMARY KEY (client_id, ring_idx)
) ENGINE = NDB,
COMMENT="NDB_TABLE=MAX_ROWS_PER_PK=4@ring_idx@ring_meta";
SHOW CREATE TABLE test.rb;
Table	Create Table
rb	CREATE TABLE `rb` (
  `client_id` int NOT NULL,
  `ring_idx` int NOT NULL DEFAULT '0',
  `ring_meta` varbinary(64) DEFAULT NULL,
  `event_data` varchar(100) DEFAULT NULL,
  PRIMARY KEY (`client_id`,`ring_idx`)
) ENGINE=ndbcluster DEFAULT CHARSET=utf8mb4 COLLATE=utf8mb4_0900_ai_ci COMMENT='NDB_TABLE=MAX_ROWS_PER_PK=4@ring_idx@ring_meta'
#
# Case 2: Basic INSERT replicates to slave
#
INSERT INTO test.rb (client_id, event_data) VALUES (1, 'ev_A');
INSERT INTO test.rb (client_id, event_data) VALUES (1, 'ev_B');
INSERT INTO test.rb (client_id, event_data) VALUES (1, 'ev_C');
SELECT client_id, ring_idx, event_data FROM test.rb
WHERE client_id = 1 ORDER BY ring_idx;
client_id	ring_idx	event_data
1	1	ev_A
1	2	ev_B
1	3	ev_C
SELECT client_id, ring_idx, event_data FROM test.rb
WHERE client_id = 1 ORDER BY ring_idx;
client_id	ring_idx	event_data
1	1	ev_A
1	2	ev_B
1	3	ev_C
#
# Case 3: Ring wrapping replicates correctly
#
INSERT INTO test.rb (client_id, event_data) VALUES (1, 'ev_D');
INSERT INTO test.rb (client_id, event_data) VALUES (1, 'ev_E');
INSERT INTO test.rb (client_id, event_data) VALUES (1, 'ev_F');
SELECT client_id, ring_idx, event_data FROM test.rb
WHERE client_id = 1 ORDER BY ring_idx;
client_id	ring_idx	event_data
1	1	ev_E
1	2	ev_F
1	3	ev_C
1	4	ev_D
SELECT client_id, ring_idx, event_data FROM test.rb
WHERE client_id = 1 ORDER BY ring_idx;
client_id	ring_idx	event_data
1	1	ev_E
1	2	ev_F
1	3	ev_C
1	4	ev_D
#
# Case 4: Multiple PK prefixes replicate independently
#
INSERT INTO test.rb (client_id, event_data) VALUES (2, 'c2_A');
INSERT INTO test.rb (client_id, event_data) VALUES (2, 'c2_B');
INSERT INTO test.rb (client_id, event_data) VALUES (3, 'c3_A');
SELECT client_id, ring_idx, event_data FROM test.rb
ORDER BY client_id, ring_idx;
client_id	ring_idx	event_data
1	1	ev_E
1	2	ev_F
1	3	ev_C
1	4	ev_D
2	1	c2_A
2	2	c2_B
3	1	c3_A
SELECT client_id, ring_idx, event_data FROM test.rb
ORDER BY client_id, ring_idx;
client_id	ring_idx	event_data
1	1	ev_E
1	2	ev_F
1	3	ev_C
1	4	ev_D
2	1	c2_A
2	2	c2_B
3	1	c3_A
#
# Case 5: Bulk INSERT replicates correctly
#
CREATE TABLE test.rb_bulk (
id INT NOT NULL,
ring_idx INT NOT NULL DEFAULT 0,
ring_meta VARBINARY(64),
data VARCHAR(100),
PRIMARY KEY (id, ring_idx)
) ENGINE = NDB,
COMMENT="NDB_TABLE=MAX_ROWS_PER_PK=5@ring_idx@ring_meta";
INSERT INTO test.rb_bulk (id, data) VALUES (1, 'b1');
INSERT INTO test.rb_bulk (id, data) VALUES (1, 'b2');
INSERT INTO test.rb_bulk (id, data) VALUES (1, 'b3');
INSERT INTO test.rb_bulk (id, data) VALUES (1, 'b4');
INSERT INTO test.rb_bulk (id, data) VALUES (1, 'b5');
SELECT id, ring_idx, data FROM test.rb_bulk WHERE id = 1 ORDER BY ring_idx;
id	ring_idx	data
1	1	b1
1	2	b2
1	3	b3
1	4	b4
1	5	b5
SELECT id, ring_idx, data FROM test.rb_bulk WHERE id = 1 ORDER BY ring_idx;
id	ring_idx	data
1	1	b1
1	2	b2
1	3	b3
1	4	b4
1	5	b5
#
# Case 6: UPDATE replicates to slave
#
UPDATE test.rb SET event_data = 'UPDATED' WHERE client_id = 2 AND ring_idx = 1;
SELECT client_id, ring_idx, event_data FROM test.rb
WHERE client_id = 2 ORDER BY ring_idx;
client_id	ring_idx	event_data
2	1	UPDATED
2	2	c2_B
SELECT client_id, ring_idx, event_data FROM test.rb
WHERE client_id = 2 ORDER BY ring_idx;
client_id	ring_idx	event_data
2	1	UPDATED
2	2	c2_B
#
# Case 7: DELETE replicates to slave
#
DELETE FROM test.rb WHERE client_id = 3;
SELECT client_id, ring_idx, event_data FROM test.rb
WHERE client_id = 3 ORDER BY ring_idx;
client_id	ring_idx	event_data
SELECT client_id, ring_idx, event_data FROM test.rb
WHERE client_id = 3 ORDER BY ring_idx;
client_id	ring_idx	event_data
#
# Case 8: Meta rows replicated and visible on slave with show_meta
#
SET ndb_ring_buffer_show_meta = ON;
SELECT client_id, ring_idx FROM test.rb
WHERE client_id = 1 ORDER BY ring_idx;
client_id	ring_idx
1	0
1	1
1	2
1	3
1	4
SET ndb_ring_buffer_show_meta = OFF;
SET ndb_ring_buffer_show_meta = ON;
SELECT client_id, ring_idx FROM test.rb
WHERE client_id = 1 ORDER BY ring_idx;
client_id	ring_idx
1	0
1	1
1	2
1	3
1	4
SET ndb_ring_buffer_show_meta = OFF;
#
# Case 9: TRUNCATE TABLE replicates to slave
#
SELECT client_id, ring_idx, event_data FROM test.rb
ORDER BY client_id, ring_idx;
client_id	ring_idx	event_data
1	1	ev_E
1	2	ev_F
1	3	ev_C
1	4	ev_D
2	1	UPDATED
2	2	c2_B
TRUNCATE TABLE test.rb;
SELECT COUNT(*) AS master_cnt FROM test.rb;
master_cnt
0
SELECT COUNT(*) AS slave_cnt FROM test.rb;
slave_cnt
0
SET ndb_ring_buffer_show_meta = ON;
SELECT COUNT(*) AS slave_all_cnt FROM test.rb;
slave_all_cnt
0
SET ndb_ring_buffer_show_meta = OFF;
#
# Case 10: Re-INSERT after TRUNCATE replicates correctly
#
INSERT INTO test.rb (client_id, event_data) VALUES (1, 'post_trunc_A');
INSERT INTO test.rb (client_id, event_data) VALUES (1, 'post_trunc_B');
SELECT client_id, ring_idx, event_data FROM test.rb
WHERE client_id = 1 ORDER BY ring_idx;
client_id	ring_idx	event_data
1	1	post_trunc_A
1	2	post_trunc_B
SELECT client_id, ring_idx, event_data FROM test.rb
WHERE client_id = 1 ORDER BY ring_idx;
client_id	ring_idx	event_data
1	1	post_trunc_A
1	2	post_trunc_B
#
# Case 11: ALTER TABLE grow replicates to slave
#
ALTER TABLE test.rb COMMENT="NDB_TABLE=NOLOGGING=1,MAX_ROWS_PER_PK=8@ring_idx@ring_meta";
SHOW CREATE TABLE test.rb;
Table	Create Table
rb	CREATE TABLE `rb` (
  `client_id` int NOT NULL,
  `ring_idx` int NOT NULL DEFAULT '0',
  `ring_meta` varbinary(64) DEFAULT NULL,
  `event_data` varchar(100) DEFAULT NULL,
  PRIMARY KEY (`client_id`,`ring_idx`)
) ENGINE=ndbcluster DEFAULT CHARSET=utf8mb4 COLLATE=utf8mb4_0900_ai_ci COMMENT='NDB_TABLE=NOLOGGING=1,MAX_ROWS_PER_PK=8@ring_idx@ring_meta'
SHOW CREATE TABLE test.rb;
Table	Create Table
rb	CREATE TABLE `rb` (
  `client_id` int NOT NULL,
  `ring_idx` int NOT NULL DEFAULT '0',
  `ring_meta` varbinary(64) DEFAULT NULL,
  `event_data` varchar(100) DEFAULT NULL,
  PRIMARY KEY (`client_id`,`ring_idx`)
) ENGINE=ndbcluster DEFAULT CHARSET=utf8mb4 COLLATE=utf8mb4_0900_ai_ci COMMENT='NDB_TABLE=NOLOGGING=1,MAX_ROWS_PER_PK=8@ring_idx@ring_meta'
#
# Case 12: INSERT after grow uses new ring size
#
INSERT INTO test.rb (client_id, event_data) VALUES (1, 'grow_C');
INSERT INTO test.rb (client_id, event_data) VALUES (1, 'grow_D');
INSERT INTO test.rb (client_id, event_data) VALUES (1, 'grow_E');
INSERT INTO test.rb (client_id, event_data) VALUES (1, 'grow_F');
INSERT INTO test.rb (client_id, event_data) VALUES (1, 'grow_G');
INSERT INTO test.rb (client_id, event_data) VALUES (1, 'grow_H');
SELECT client_id, ring_idx, event_data FROM test.rb
WHERE client_id = 1 ORDER BY ring_idx;
client_id	ring_idx	event_data
1	1	post_trunc_A
1	2	post_trunc_B
1	3	grow_C
1	4	grow_D
1	5	grow_E
1	6	grow_F
1	7	grow_G
1	8	grow_H
INSERT INTO test.rb (client_id, event_data) VALUES (1, 'wrap_I');
SELECT client_id, ring_idx, event_data FROM test.rb
WHERE client_id = 1 ORDER BY ring_idx;
client_id	ring_idx	event_data
1	1	wrap_I
1	2	post_trunc_B
1	3	grow_C
1	4	grow_D
1	5	grow_E
1	6	grow_F
1	7	grow_G
1	8	grow_H
SELECT client_id, ring_idx, event_data FROM test.rb
WHERE client_id = 1 ORDER BY ring_idx;
client_id	ring_idx	event_data
1	1	wrap_I
1	2	post_trunc_B
1	3	grow_C
1	4	grow_D
1	5	grow_E
1	6	grow_F
1	7	grow_G
1	8	grow_H
#
# Case 13: DELETE + re-INSERT cycle replicates
#
DELETE FROM test.rb WHERE client_id = 1;
INSERT INTO test.rb (client_id, event_data) VALUES (1, 'cycle_A');
SELECT client_id, ring_idx, event_data FROM test.rb
WHERE client_id = 1 ORDER BY ring_idx;
client_id	ring_idx	event_data
1	1	cycle_A
SELECT client_id, ring_idx, event_data FROM test.rb
WHERE client_id = 1 ORDER BY ring_idx;
client_id	ring_idx	event_data
1	1	cycle_A
#
# Case 14: NOT NULL + unique index replicates correctly
#
CREATE TABLE test.rb_nn_uniq (
id INT NOT NULL,
ring_idx INT NOT NULL DEFAULT 0,
ring_meta VARBINARY(64),
code INT NOT NULL,
PRIMARY KEY (id, ring_idx),
UNIQUE INDEX idx_code (code)
) ENGINE = NDB,
COMMENT="NDB_TABLE=MAX_ROWS_PER_PK=3@ring_idx@ring_meta";
INSERT INTO test.rb_nn_uniq (id, code) VALUES (1, 100);
INSERT INTO test.rb_nn_uniq (id, code) VALUES (2, 200);
INSERT INTO test.rb_nn_uniq (id, code) VALUES (1, 300);
INSERT INTO test.rb_nn_uniq (id, code) VALUES (1, 400);
SELECT id, ring_idx, code FROM test.rb_nn_uniq ORDER BY id, ring_idx;
id	ring_idx	code
1	1	100
1	2	300
1	3	400
2	1	200
SELECT id, ring_idx, code FROM test.rb_nn_uniq ORDER BY id, ring_idx;
id	ring_idx	code
1	1	100
1	2	300
1	3	400
2	1	200
INSERT INTO test.rb_nn_uniq (id, code) VALUES (1, 500);
INSERT INTO test.rb_nn_uniq (id, code) VALUES (2, 100);
SELECT id, ring_idx, code FROM test.rb_nn_uniq ORDER BY id, ring_idx;
id	ring_idx	code
1	1	500
1	2	300
1	3	400
2	1	200
2	2	100
SELECT id, ring_idx, code FROM test.rb_nn_uniq ORDER BY id, ring_idx;
id	ring_idx	code
1	1	500
1	2	300
1	3	400
2	1	200
2	2	100
#
# Cleanup
#
DROP TABLE test.rb;
DROP TABLE test.rb_bulk;
DROP TABLE test.rb_nn_uniq;
include/rpl/deinit.inc
