#
# Setup: ring-buffer table with secondary index on user column
#
CREATE TABLE test.rb_idx (
client_id INT NOT NULL,
ring_idx INT NOT NULL DEFAULT 0,
ring_meta VARBINARY(64),
event_type VARCHAR(50),
amount INT,
PRIMARY KEY (client_id, ring_idx),
INDEX idx_event_type (event_type),
INDEX idx_amount (amount)
) ENGINE = NDB,
COMMENT="NDB_TABLE=MAX_ROWS_PER_PK=4@ring_idx@ring_meta";
INSERT INTO test.rb_idx (client_id, event_type, amount) VALUES (1, 'login', 10);
INSERT INTO test.rb_idx (client_id, event_type, amount) VALUES (1, 'purchase', 50);
INSERT INTO test.rb_idx (client_id, event_type, amount) VALUES (1, 'login', 20);
INSERT INTO test.rb_idx (client_id, event_type, amount) VALUES (1, 'refund', 30);
INSERT INTO test.rb_idx (client_id, event_type, amount) VALUES (2, 'login', 5);
INSERT INTO test.rb_idx (client_id, event_type, amount) VALUES (2, 'purchase', 100);
#
# Case 1: SELECT via secondary index on VARCHAR — meta rows hidden
#
SELECT client_id, ring_idx, event_type, amount FROM test.rb_idx
WHERE event_type = 'login'
    ORDER BY client_id, ring_idx;
client_id	ring_idx	event_type	amount
1	1	login	10
1	3	login	20
2	1	login	5
#
# Case 2: SELECT via secondary index on INT — meta rows hidden
#
SELECT client_id, ring_idx, event_type, amount FROM test.rb_idx
WHERE amount >= 20
ORDER BY client_id, ring_idx;
client_id	ring_idx	event_type	amount
1	2	purchase	50
1	3	login	20
1	4	refund	30
2	2	purchase	100
#
# Case 3: COUNT via secondary index — correct count (no meta rows)
#
SELECT COUNT(*) AS cnt FROM test.rb_idx WHERE event_type = 'login';
cnt
3
SELECT COUNT(*) AS cnt FROM test.rb_idx WHERE amount > 0;
cnt
6
#
# Case 4: Range scan via secondary index — meta rows hidden
#
SELECT client_id, ring_idx, event_type, amount FROM test.rb_idx
WHERE amount BETWEEN 10 AND 50
ORDER BY amount;
client_id	ring_idx	event_type	amount
1	1	login	10
1	3	login	20
1	4	refund	30
1	2	purchase	50
#
# Case 5: After wrap — secondary index scan still filters meta rows
#
INSERT INTO test.rb_idx (client_id, event_type, amount) VALUES (1, 'login', 60);
INSERT INTO test.rb_idx (client_id, event_type, amount) VALUES (1, 'purchase', 70);
SELECT client_id, ring_idx, event_type, amount FROM test.rb_idx
WHERE event_type = 'login'
    ORDER BY client_id, ring_idx;
client_id	ring_idx	event_type	amount
1	1	login	60
1	3	login	20
2	1	login	5
SELECT client_id, ring_idx, event_type, amount FROM test.rb_idx
WHERE event_type = 'purchase'
    ORDER BY client_id, ring_idx;
client_id	ring_idx	event_type	amount
1	2	purchase	70
2	2	purchase	100
#
# Case 6: UPDATE via secondary index WHERE on user column — allowed
#
UPDATE test.rb_idx SET amount = amount + 1000
WHERE event_type = 'refund';
SELECT client_id, ring_idx, event_type, amount FROM test.rb_idx
WHERE client_id = 1
ORDER BY ring_idx;
client_id	ring_idx	event_type	amount
1	1	login	60
1	2	purchase	70
1	3	login	20
1	4	refund	1030
#
# Case 7: GROUP BY with secondary index — meta rows excluded
#
SELECT event_type, COUNT(*) AS cnt, SUM(amount) AS total
FROM test.rb_idx
GROUP BY event_type
ORDER BY event_type;
event_type	cnt	total
login	3	85
purchase	2	170
refund	1	1030
#
# Case 8: show_meta=ON — meta rows visible even via secondary index scan
#
SET ndb_ring_buffer_show_meta = ON;
SELECT client_id, ring_idx, event_type, amount FROM test.rb_idx
ORDER BY client_id, ring_idx;
client_id	ring_idx	event_type	amount
1	0	NULL	NULL
1	1	login	60
1	2	purchase	70
1	3	login	20
1	4	refund	1030
2	0	NULL	NULL
2	1	login	5
2	2	purchase	100
SET ndb_ring_buffer_show_meta = OFF;
#
# Case 9: Unique index on user column
#
DROP TABLE test.rb_idx;
CREATE TABLE test.rb_uniq (
id INT NOT NULL,
ring_idx INT NOT NULL DEFAULT 0,
ring_meta VARBINARY(64),
code VARCHAR(20),
val INT,
PRIMARY KEY (id, ring_idx),
UNIQUE INDEX idx_code (code)
) ENGINE = NDB,
COMMENT="NDB_TABLE=MAX_ROWS_PER_PK=3@ring_idx@ring_meta";
INSERT INTO test.rb_uniq (id, code, val) VALUES (1, 'AAA', 10);
INSERT INTO test.rb_uniq (id, code, val) VALUES (1, 'BBB', 20);
INSERT INTO test.rb_uniq (id, code, val) VALUES (1, 'CCC', 30);
SELECT id, ring_idx, code, val FROM test.rb_uniq
WHERE code = 'BBB';
id	ring_idx	code	val
1	2	BBB	20
INSERT INTO test.rb_uniq (id, code, val) VALUES (1, 'DDD', 40);
SELECT id, ring_idx, code, val FROM test.rb_uniq
ORDER BY ring_idx;
id	ring_idx	code	val
1	1	DDD	40
1	2	BBB	20
1	3	CCC	30
DROP TABLE test.rb_uniq;
#
# Case 10: ALTER TABLE ADD INDEX on existing ring-buffer table
#
CREATE TABLE test.rb_add_idx (
id INT NOT NULL,
ring_idx INT NOT NULL DEFAULT 0,
ring_meta VARBINARY(64),
category VARCHAR(30),
PRIMARY KEY (id, ring_idx)
) ENGINE = NDB,
COMMENT="NDB_TABLE=MAX_ROWS_PER_PK=3@ring_idx@ring_meta";
INSERT INTO test.rb_add_idx (id, category) VALUES (1, 'alpha');
INSERT INTO test.rb_add_idx (id, category) VALUES (1, 'beta');
INSERT INTO test.rb_add_idx (id, category) VALUES (2, 'alpha');
ALTER TABLE test.rb_add_idx ADD INDEX idx_cat (category);
SELECT id, ring_idx, category FROM test.rb_add_idx
WHERE category = 'alpha'
    ORDER BY id, ring_idx;
id	ring_idx	category
1	1	alpha
2	1	alpha
INSERT INTO test.rb_add_idx (id, category) VALUES (1, 'gamma');
INSERT INTO test.rb_add_idx (id, category) VALUES (1, 'delta');
SELECT id, ring_idx, category FROM test.rb_add_idx
WHERE category = 'alpha'
    ORDER BY id, ring_idx;
id	ring_idx	category
2	1	alpha
SELECT id, ring_idx, category FROM test.rb_add_idx
ORDER BY id, ring_idx;
id	ring_idx	category
1	1	delta
1	2	beta
1	3	gamma
2	1	alpha
DROP TABLE test.rb_add_idx;
#
# Done.
#
